{
  "verdict_id": "V-201-1",
  "cluster_id": "K-201",
  "readjudicated_by": "B5_readjudicate",
  "supersedes_verdict_id": null,
  "votes": [],
  "missing_votes": [],
  "tool_corroboration": [],
  "tool_signal": [],
  "independent_sources": 0,
  "executable_proof": {
    "testcase_id": "TC-033-01",
    "result_ref": "sha256:022cce2f629d51e4dcc6ec37313fa2feb2fe41f6a12738df4ddf408b7837dd36",
    "trials": null,
    "interpretation_confirmed_by": null
  },
  "test_evidence": {
    "class": "E_proof",
    "results": [
      {
        "result_ref": "sha256:022cce2f629d51e4dcc6ec37313fa2feb2fe41f6a12738df4ddf408b7837dd36",
        "class": "E_proof",
        "positive_control": true,
        "reason": "FAIL，重播 2 次相同；確定性 oracle（STATUS_AND_BODY），G4 預先登記解讀，不需要 LLM 分析者"
      }
    ]
  },
  "diversity_degraded": true,
  "no_eligible_verifier": false,
  "calibration_version": 3,
  "theta_confirm": 1.2,
  "theta_reject": null,
  "provisional": false,
  "score": 0,
  "g2_decision_ref": null,
  "status": "CONFIRMED_EXECUTABLE",
  "status_cap": null,
  "advisory": false,
  "annotations": [],
  "decided_by": "aggregator",
  "rule_version": "05-v0.4",
  "rule_trace": [
    "R1:E_proof(R-TC-033-01-1),deterministic oracle,pre-registered at G4,no LLM analyst->CONFIRMED_EXECUTABLE"
  ]
}
