{
  "verdict_id": "V-011-1",
  "cluster_id": "K-011",
  "readjudicated_by": "W3_adjudicate",
  "supersedes_verdict_id": null,
  "votes": [
    {
      "voter_agent_id": "ver_1",
      "voter_model_key": "nemotron_self",
      "voter_family": "nvidia",
      "voter_lineage": "nemotron3",
      "stance": "SUPPORT",
      "rationale": "app/support/agent.py:57 把 refund 直接交給 agent，前面沒有確認步驟，也沒有比對訂單擁有者。",
      "cited_evidence": [
        "app/support/agent.py:57"
      ],
      "fallback_used": null,
      "anonymized": true,
      "order_randomized": true,
      "valid": true,
      "weight": 0.0,
      "weighted_valid": false
    }
  ],
  "missing_votes": [],
  "tool_corroboration": [],
  "tool_signal": [],
  "independent_sources": 1,
  "executable_proof": null,
  "test_evidence": {
    "class": null,
    "results": []
  },
  "diversity_degraded": true,
  "no_eligible_verifier": false,
  "calibration_version": 3,
  "theta_confirm": null,
  "theta_reject": null,
  "provisional": true,
  "score": 0.0,
  "g2_decision_ref": null,
  "status": "UNCORROBORATED",
  "status_cap": null,
  "advisory": false,
  "annotations": [],
  "decided_by": "aggregator",
  "rule_version": "05-v0.7",
  "rule_trace": [
    "R2:weighted_support=1,score=0.6222<theta_confirm=1.2",
    "R7:independent_families=1->UNCORROBORATED"
  ]
}
